{
	"post_file": "posts/2024-01-15-some-random-post.md",
	"post_title": "Making sense of the AP Computer Science A exam format",
	"tags": [1],
	"authors": [34557],
	"display_date": "2024-01-15",
	"description": "This is an example post description.",
	"tldr": "TL;DR: Example TL;DR summary.",
	"keywords": ["example", "post", "keywords"],
	"subtitle": "Example Post Subtitle"
}
